{
  "schema_version": "1.1.0",
  "synthetic": false,
  "notice": "Automated transcription and extraction; verify against the linked source audio.",
  "episode": {
    "guid": "tag:soundcloud,2010:tracks/2324598305",
    "episode_number": 522,
    "title": "MTG Fast Finance Ep 522: SOS Brick Targets",
    "published_at": "2026-05-21T01:37:13Z",
    "audio_url": "https://feeds.soundcloud.com/stream/2324598305-user-519789566-mtg-fast-finance-ep-522-sos.mp3",
    "episode_url": "https://soundcloud.com/user-519789566/mtg-fast-finance-ep-522-sos",
    "duration_seconds": 4271,
    "hosts": [
      "MTG Fast Finance"
    ],
    "description": "The guys get you updated on all the Magic the Gathering card price action of the week, including meta updates, cards to watch and a call by call on the best SOS singles to target as speculative bricks.\n\nIntro/Outro Music by Skylarka"
  },
  "processing": {
    "status": "needs_review",
    "review_state": "needs_review",
    "review_reason": "Section start found, but no explicit end marker was detected.",
    "pipeline_version": "0.3.1",
    "schema_version": "1.1.0",
    "transcription_model": "gemini-3.5-flash",
    "extraction_model": "gemini-3.5-flash",
    "prompt_version": "cards-to-watch-v2",
    "processed_at": "2026-07-26T21:19:53Z",
    "history": [
      {
        "status": "detected",
        "timestamp": "2026-07-24T11:56:20Z"
      },
      {
        "status": "queued",
        "timestamp": "2026-07-24T11:56:21Z"
      },
      {
        "status": "queued",
        "timestamp": "2026-07-24T11:56:21Z"
      },
      {
        "status": "downloading",
        "timestamp": "2026-07-24T11:56:21Z"
      },
      {
        "status": "downloaded",
        "timestamp": "2026-07-24T11:56:24Z"
      },
      {
        "status": "preparing",
        "timestamp": "2026-07-24T11:56:24Z"
      },
      {
        "status": "transcribing",
        "timestamp": "2026-07-24T11:56:51Z"
      },
      {
        "status": "failed",
        "timestamp": "2026-07-24T12:00:37Z"
      },
      {
        "status": "queued",
        "timestamp": "2026-07-26T21:11:50Z"
      },
      {
        "status": "downloading",
        "timestamp": "2026-07-26T21:11:50Z"
      },
      {
        "status": "downloaded",
        "timestamp": "2026-07-26T21:11:53Z"
      },
      {
        "status": "preparing",
        "timestamp": "2026-07-26T21:11:53Z"
      },
      {
        "status": "transcribing",
        "timestamp": "2026-07-26T21:12:20Z"
      },
      {
        "status": "transcribed",
        "timestamp": "2026-07-26T21:18:59Z"
      },
      {
        "status": "extracting",
        "timestamp": "2026-07-26T21:18:59Z"
      },
      {
        "status": "extracted",
        "timestamp": "2026-07-26T21:19:53Z"
      },
      {
        "status": "validating",
        "timestamp": "2026-07-26T21:19:53Z"
      },
      {
        "status": "publishing",
        "timestamp": "2026-07-26T21:19:53Z"
      },
      {
        "status": "needs_review",
        "timestamp": "2026-07-26T21:19:53Z"
      }
    ],
    "error": null,
    "transcription": {
      "provider": "Gemini",
      "model": "gemini-3.5-flash",
      "models": [
        "gemini-3.5-flash"
      ],
      "chunk_count": 4,
      "duration_seconds": 4271,
      "usage": [
        {
          "chunk": 1,
          "chunk_count": 4,
          "model": "gemini-3.5-flash",
          "audio_seconds": 1200,
          "request_seconds": 74.106,
          "provider_usage": {
            "cache_tokens_details": null,
            "cached_content_token_count": null,
            "candidates_token_count": 11797,
            "candidates_tokens_details": null,
            "prompt_token_count": 30050,
            "prompt_tokens_details": [
              {
                "modality": "TEXT",
                "token_count": 51
              },
              {
                "modality": "AUDIO",
                "token_count": 29999
              }
            ],
            "thoughts_token_count": 5991,
            "tool_use_prompt_token_count": null,
            "tool_use_prompt_tokens_details": null,
            "total_token_count": 47838,
            "traffic_type": null
          }
        },
        {
          "chunk": 2,
          "chunk_count": 4,
          "model": "gemini-3.5-flash",
          "audio_seconds": 1200,
          "request_seconds": 92.353,
          "provider_usage": {
            "cache_tokens_details": null,
            "cached_content_token_count": null,
            "candidates_token_count": 13671,
            "candidates_tokens_details": null,
            "prompt_token_count": 30050,
            "prompt_tokens_details": [
              {
                "modality": "AUDIO",
                "token_count": 29999
              },
              {
                "modality": "TEXT",
                "token_count": 51
              }
            ],
            "thoughts_token_count": 8419,
            "tool_use_prompt_token_count": null,
            "tool_use_prompt_tokens_details": null,
            "total_token_count": 52140,
            "traffic_type": null
          }
        },
        {
          "chunk": 3,
          "chunk_count": 4,
          "model": "gemini-3.5-flash",
          "audio_seconds": 1200,
          "request_seconds": 195.983,
          "provider_usage": {
            "cache_tokens_details": null,
            "cached_content_token_count": null,
            "candidates_token_count": 14426,
            "candidates_tokens_details": null,
            "prompt_token_count": 30050,
            "prompt_tokens_details": [
              {
                "modality": "TEXT",
                "token_count": 51
              },
              {
                "modality": "AUDIO",
                "token_count": 29999
              }
            ],
            "thoughts_token_count": 207,
            "tool_use_prompt_token_count": null,
            "tool_use_prompt_tokens_details": null,
            "total_token_count": 44683,
            "traffic_type": null
          }
        },
        {
          "chunk": 4,
          "chunk_count": 4,
          "model": "gemini-3.5-flash",
          "audio_seconds": 671,
          "request_seconds": 35.593,
          "provider_usage": {
            "cache_tokens_details": null,
            "cached_content_token_count": null,
            "candidates_token_count": null,
            "candidates_tokens_details": null,
            "prompt_token_count": 16826,
            "prompt_tokens_details": [
              {
                "modality": "TEXT",
                "token_count": 51
              },
              {
                "modality": "AUDIO",
                "token_count": 16775
              }
            ],
            "thoughts_token_count": 256,
            "tool_use_prompt_token_count": null,
            "tool_use_prompt_tokens_details": null,
            "total_token_count": 17082,
            "traffic_type": null
          }
        }
      ]
    },
    "extraction_usage": {
      "cache_tokens_details": null,
      "cached_content_token_count": null,
      "candidates_token_count": 1484,
      "candidates_tokens_details": null,
      "prompt_token_count": 21874,
      "prompt_tokens_details": [
        {
          "modality": "TEXT",
          "token_count": 21874
        }
      ],
      "thoughts_token_count": 10123,
      "tool_use_prompt_token_count": null,
      "tool_use_prompt_tokens_details": null,
      "total_token_count": 33481,
      "traffic_type": null
    }
  },
  "section": {
    "located": true,
    "start_seconds": 119,
    "end_seconds": 4399,
    "label": "Cards to Watch",
    "confidence": "medium",
    "review_reason": "Section start found, but no explicit end marker was detected."
  },
  "recommendations": [
    {
      "card": "Bitterblossom",
      "printing": "Special Guest",
      "printing_certainty": "confirmed",
      "foil": true,
      "hosts": [
        "James Chilcott"
      ],
      "recommendation": "buy",
      "mentioned_price": "$35",
      "entry_target": {
        "raw": "$35",
        "currency": "USD",
        "minimum": 35.0,
        "maximum": 35.0
      },
      "hold": null,
      "exit_target": {
        "raw": "55",
        "currency": "USD",
        "minimum": 55.0,
        "maximum": 55.0
      },
      "reasoning": [
        "Most popular version available.",
        "Eternally good in black token decks.",
        "Witherbloom looking like it's going to be the top commander out of SOS, and it wants tokens all the time."
      ],
      "caveats": [
        "A lot of competition from five or six other fancy versions like the double rainbow foil, judge foil, and box topper."
      ],
      "confidence": null,
      "start_seconds": 1500,
      "end_seconds": 1810,
      "evidence_excerpt": "I'm going to jump in here with Bitterblossom borderless foil, the Special Guest version coming out of Lord of the Rings: Tales of Middle-earth collector booster boxes.",
      "review_status": "approved",
      "review_reason": null,
      "id": "pick-6e46c07baa45b701",
      "timestamp": "00:25:00",
      "listen_url": "https://feeds.soundcloud.com/stream/2324598305-user-519789566-mtg-fast-finance-ep-522-sos.mp3#t=1500"
    },
    {
      "card": "Raph and Mikey, the Troublemakers",
      "printing": "showcase foils from Teenage Mutant Ninja Turtles",
      "printing_certainty": "confirmed",
      "foil": true,
      "hosts": [
        "Speaker 2"
      ],
      "recommendation": "buy",
      "mentioned_price": "about $8",
      "entry_target": {
        "raw": "about $8",
        "currency": "USD",
        "minimum": 8.0,
        "maximum": 8.0
      },
      "hold": "6 to 12 months",
      "exit_target": {
        "raw": "$20",
        "currency": "USD",
        "minimum": 20.0,
        "maximum": 20.0
      },
      "reasoning": [
        "Number two commander from Turtles overall.",